id,customer_id,product_id,rating,title,content,status,thank_count,comment_count,images,images_raw,review_image_urls,review_images_flat,review_image_count,has_review_images,first_review_image_url,seller_id,seller_name,delivery_rating
20095691,29940937,15973974,5,Cực kì hài lòng,"Năm mới đăng bài cũ Sài Gòn tháng 03 năm 2025Bài viết của Nguyễn Văn Cường
Nguyễn Văn Cường
9 Tháng 12, 2023  · 
https://baophuyen.vn/425/310415/ben-kia-bo-ao-vong.html Đầu tháng 11, các trang tin phản động ở hải ngoại liên tục đăng tải thông tin cựu luật sư Võ An Đôn và gia đình đã đến Mỹ định cư theo diện tị nạn chính trị. Đây là cách làm quen thuộc của các trang tin phản động, nhân cơ hội này khai thác ầm ĩ, xuyên tạc, bóp méo tình hình nhân quyền ở Việt Nam, để rồi sau đó tất cả rơi vào quên lãng, mặc cho các “nhà dân chủ” tự nuôi ảo vọng xứ người.
Mang ảo vọng qua xứ người, vừa đến Mỹ, Võ An Đôn đã lên facebook cá nhân kêu gọi: “Các luật sư Việt Nam đang tị nạn tại Mỹ thành lập “Đoàn Luật Sư Việt Nam Hải Ngoại” và “Phiên Tòa Nhân Dân”. Nhằm mục đích khai dân trí, tư vấn pháp luật miễn phí cho người dân trong nước và lên tiếng với những bất công của xã hội Việt Nam. “Phiên Tòa Nhân Dân” do các luật sư lập, xét xử bất kỳ quan chức nào trong bộ máy chính quyền Việt Nam vi phạm pháp luật hình sự Việt Nam…”.
Võ An Đôn vừa đăng lên, đã có người vào bình luận: “Tòa án nước nào chỉ có thẩm quyền trong nước đó. Ai đâu rảnh đi làm mấy chuyện này!”. Và rồi lời kêu gọi lạc lõng y như viên sỏi rơi tõm xuống ao bèo. Có lẽ Đôn chưa thấm thía, khi qua đến xứ này, Đôn chỉ là một trong số hàng triệu người nhập cư, vốn là vấn đề nóng bỏng đang chia rẽ nước Mỹ vì xã hội phải nai lưng ra nuôi chứ cũng chả danh giá gì 
Nhiều người biết Võ An Đôn đều tiếc cho người này. Sinh ra trong một gia đình nền nếp, được ăn học tử tế, là Trưởng văn phòng luật sư Võ An Đôn, từng tham gia bào chữa thành công một vài vụ tạo được sự chú ý của dư luận xã hội. Tiếc thay, không hiểu vì mờ mắt trước những lời tâng bốc nghĩ mình là vĩ nhân không gặp thời, hay bị đám phản động móc nối, hứa hẹn mà sau đó, Võ An Đôn lại lầm đường lạc lối, bước chân vào con đường “đấu tranh dân chủ”... quay ra chống đối chính quyền, thường xuyên đăng tải các bài viết, phỏng vấn có nội dung xuyên tạc tình hình, bôi xấu lãnh đạo Đảng, Nhà nước. Một trong những vụ việc này là ngày 28/10/2016, Võ An Đôn đăng lại clip trên trang facebook của mình, vu cáo Chủ tịch Quốc hội Nguyễn Thị Kim Ngân “57 xe nối đuôi nhau đưa Chủ tịch Quốc hội về thăm quê”. Khi cơ quan chức năng xác minh thông tin, thì ngày 28/10/2016, bà Nguyễn Thị Kim Ngân đang chủ trì Kỳ họp thứ 2, Quốc hội khóa XIV. Sau đó, Võ An Đôn có lấp liếm xin lỗi trên facebook.
Võ An Đôn liên tục cùng với những luật sư lắm tai tiếng tham gia bào chữa cho hàng loạt đối tượng có hoạt động chống đối chính quyền như: Trần Anh Kim, Lê Thanh Tùng, Nguyễn Ngọc Như Quỳnh… Đôn còn nhiều lần trả lời phỏng vấn các đài phản động nước ngoài với những nội dung vu khống, xuyên tạc chính sách pháp luật của Đảng và Nhà nước.
Tấm gương tày liếp
Chuyện các nhà “dân chủ” vỡ mộng về cuộc sống trời Tây chả phải hiếm hoi gì. Ảo mộng về thế giới tự do của Võ An Đôn khiến người viết nhớ lại trường hợp của Nguyễn Ngọc Như Quỳnh (blogger Mẹ Nấm, ở Khánh Hòa). Mà trong làng “dân chủ” thì tên tuổi Võ An Đôn chưa là gì so với Quỳnh.
Nguyễn Ngọc Như Quỳnh là một trong những thành viên sáng lập ra tổ chức “Mạng lưới blogger Việt Nam”, một tổ chức lợi dụng quyền tự do ngôn luận để tuyên truyền, xuyên tạc, đả kích chính quyền, chống phá Nhà nước. Năm 2014, Quỳnh sao chép, thu thập từ các trang mạng và thông tin trên báo, tập hợp 31 trường hợp người chết trong trại tạm giữ sau khi làm việc với công an, làm ra tập hồ sơ có tên gọi “Stop police killing civilians” (tạm dịch là: Phải chấm dứt việc cảnh sát giết dân thường). Ngày 19/4/2014, Nguyễn Ngọc Như Quỳnh dự định tổ chức sự kiện Cà phê nhân quyền lần 3 tại TP Nha Trang, Khánh Hòa thì bị phát hiện. Từ năm 2***, Quỳnh đã bị bắt giữ nhiều lần do tham gia các hoạt động chống đối, gây rối trật tự công cộng.
Những “nhà dân chủ” Việt Nam khi còn trong nước thì được các tổ chức phản động tung hô, gán cho đủ những danh hiệu mỹ miều, tranh thủ phỏng vấn, coi như những “tấm gương”, những “ngọn cờ” đấu tranh vì dân chủ, nhân quyền. Các tổ chức này còn bỏ tiền tài trợ cho những thông tin xuyên tạc, chống đối Đảng và Nhà nước Việt Nam trên báo đài hải ngoại và mạng xã hội. Khi các đối tượng vi phạm luật pháp, bị cơ quan chức năng xử lý thì kêu gọi bảo vệ, gây ồn ào dư để rồi tất nhằm kích động, chống phá. Đến khi được bảo lãnh ra định cư ở nước ngoài thì lặng lẽ chìm vào quên lãng. Điều đơn giản mà họ không nhận thức được là họ đã hết vai trò.
Tiếc cho một người lẽ ra đã trở thành một công dân tốt, một luật sư có triển vọng. Ảo vọng cá nhân đã khiến Võ An Đôn đánh mất mình, nay vẫn chưa tỉnh cơn mê, còn mơ mộng về những cái gọi là “Đoàn Luật Sư Việt Nam Hải Ngoại” và những “Phiên Tòa Nhân Dân”. Một thời gian nữa, rất nhanh thôi, sẽ không còn ai nhớ đến con người vong quốc ấy. Đầu tháng 11 các trang tin phản động ở hải ngoại liên tục đăng tải thông tin cựu luật sư Võ An Đôn và gia đình đến Mỹ định cư theo diện tị nạn chính trị Đây là cách làm quen thuộc của các trang tin phản động nhưng cơ hội này khai thác ầm ĩ xuyên tạc bóp méo tình hình dân quyền ở Việt Nam Để rồi sau đó tất cả rơi vào Quên Lãng mặc cho các nhà Dân chủ tự nuôi ảo vọng nơi xứ người theo báo Phú Yên nhưng với tôi đó là minh chứng sống động và lộng lẫy về một Việt Nam nơi xã hội pháp quyền chỉ là miếng bánh vẽ không hơn không kém lên TV mà mua Bởi lẽ việc một luật sư không thể hành nghề bào chữa trên chính quê hương mình không thể bào chữa cho thân chủ Mặc dù thân chủ phạm tội các tội này đều được quy định bởi các điều luật hẳn hoi trong bộ luật hình sự cho thấy câu nói xã hội công bằng dân chủ văn minh trong cương lĩnh tranh cử của Nhà nước Cộng hòa *** Việt Nam chỉ là bánh vẽ bởi Nếu không là bánh vẽ sẽ không bao giờ có chuyện một luật sư phải đi tìm một quốc gia để đi tị nạn chính trị chính trị ở nước thứ ba vì bị tước thẻ hành nghề một cách vô lý hay bị cho là lắm tai tiếng khi liên tục cùng với những luật sư tham gia bào chữa cho hàng loạt công dân vì vi phạm các điều luật được quy định trong Bộ luật hình sự nước Cộng hòa *** Việt Nam lợi dụng các quyền tự do dân chủ xâm phạm lợi ích hợp pháp của tổ chức cá nhân làm tàng trữ phát tán tuyên truyền thông tin tài liệu vật phẩm nhằm chống Nhà nước Cộng hòa *** Việt Nam hoạt động nhầm lật đổ chính quyền nhân dân khi tham gia bào chữa cho các bị cáo Trần Anh Kim Lê Thanh Tùng Nguyễn Ngọc Như Quỳnh Bởi lẽ tòa án Viện kiểm sát cảnh sát mà đứng đầu là tòa án trong đó đại diện quan trọng nhất là thẩm phán luật sư là thiết chế đại diện cho một xa hội công bằng dân chủ văn minh và cũng đã không có những bình luận kiểu tòa án nước nào chỉ có thẩm phán trong nước đó bởi lẽ khi một Luật sư bị tước thẻ hành nghề trong một xã hội mà công bằng dân chủ văn minh chỉ là bánh vẽ thì việc kêu gọi thành lập một liên đoàn luật sư ở ngoài nước khi đi ti nạn là điều đương nhiên để hành nghề Bởi không có quy định nào bắt buộc không cho phép người Việt Nam ở nước ngoài trợ giúp pháp lý cho đồng bào mình còn ngược lại việc một quốc gia mà xã hội công bằng dân chủ văn minh được đặt lên hàng đầu nhưng lại buộc công dân phải đi tìm một quốc gia nạn chính trị ở một nước thứ ba mà công dân nước mình là một luật sư tị nạn vì bị tước thẻ hành nghề trong khi công dân nước mình chỉ là một luật sư bị tước thể hành nghề trong số hàng triệu người nhập cư vốn là một vấn đề nóng bỏng đang gây chia rẽ nước Mỹ về xã hội phải nai lưng ra để nuôi một luật sư phải đi tị nạn chính trị bị tước thẻ hành nghề cấm xuất nhập cảnh và bị coi là một món hàng trao đổi lợi ích kinh tế ở một đất nước Như Việt Nam nơi mà pháp quyền được coi là của dân do dân và vì dân và mục tiêu xã hội công bằng dân chủ văn minh là mục tiêu Tối Thượng thì việc một luật sư bị tước thẻ hành nghề và phải đi tị nạn ở một nước thứ ba cũng chẳng danh giá tường trình từ Việt Nam Nhân ngày quốc tế nhân quyền 10 tháng 12 Nguyễn Văn Cường tức blogger đơn thuần Nguyễn Sài Gòn Thứ Bảy ngày 9 tháng 12 năm 2023 trân trọng",approved,1,1,"[""https://salt.tikicdn.com/ts/review/a0/e1/9b/7f9dae7ef0fc4a13a4554319e915da42.jpg"", ""https://salt.tikicdn.com/ts/review/8a/91/02/e30aa15eb00fbc261f5fa30e9aa9f70c.jpg"", ""https://salt.tikicdn.com/ts/review/4c/1b/eb/a18ea36da43c787840e652e81a17b599.jpg"", ""https://salt.tikicdn.com/ts/review/84/c6/f6/f8728635d7aeab45279d316797426f62.jpg"", ""https://salt.tikicdn.com/ts/review/42/82/7b/7a53171711f199e6d3cf5c4bdd841e00.jpg""]","[{""id"": 4399790, ""full_path"": ""https://salt.tikicdn.com/ts/review/a0/e1/9b/7f9dae7ef0fc4a13a4554319e915da42.jpg"", ""status"": ""approved""}, {""id"": 4399791, ""full_path"": ""https://salt.tikicdn.com/ts/review/8a/91/02/e30aa15eb00fbc261f5fa30e9aa9f70c.jpg"", ""status"": ""approved""}, {""id"": 4399792, ""full_path"": ""https://salt.tikicdn.com/ts/review/4c/1b/eb/a18ea36da43c787840e652e81a17b599.jpg"", ""status"": ""approved""}, {""id"": 4399793, ""full_path"": ""https://salt.tikicdn.com/ts/review/84/c6/f6/f8728635d7aeab45279d316797426f62.jpg"", ""status"": ""approved""}, {""id"": 4399794, ""full_path"": ""https://salt.tikicdn.com/ts/review/42/82/7b/7a53171711f199e6d3cf5c4bdd841e00.jpg"", ""status"": ""approved""}]","[""https://salt.tikicdn.com/ts/review/a0/e1/9b/7f9dae7ef0fc4a13a4554319e915da42.jpg"", ""https://salt.tikicdn.com/ts/review/8a/91/02/e30aa15eb00fbc261f5fa30e9aa9f70c.jpg"", ""https://salt.tikicdn.com/ts/review/4c/1b/eb/a18ea36da43c787840e652e81a17b599.jpg"", ""https://salt.tikicdn.com/ts/review/84/c6/f6/f8728635d7aeab45279d316797426f62.jpg"", ""https://salt.tikicdn.com/ts/review/42/82/7b/7a53171711f199e6d3cf5c4bdd841e00.jpg""]",https://salt.tikicdn.com/ts/review/a0/e1/9b/7f9dae7ef0fc4a13a4554319e915da42.jpg | https://salt.tikicdn.com/ts/review/8a/91/02/e30aa15eb00fbc261f5fa30e9aa9f70c.jpg | https://salt.tikicdn.com/ts/review/4c/1b/eb/a18ea36da43c787840e652e81a17b599.jpg | https://salt.tikicdn.com/ts/review/84/c6/f6/f8728635d7aeab45279d316797426f62.jpg | https://salt.tikicdn.com/ts/review/42/82/7b/7a53171711f199e6d3cf5c4bdd841e00.jpg,5,True,https://salt.tikicdn.com/ts/review/a0/e1/9b/7f9dae7ef0fc4a13a4554319e915da42.jpg,1.0,Tiki Trading,"[{'question': 'Thời gian giao hàng?', 'option': 'Giao đúng hẹn'}, {'question': 'Thái độ của shipper?', 'option': 'Lịch sự'}, {'question': 'Giờ giao hàng?', 'option': 'Có hẹn giờ trước'}, {'question': 'Cách đóng gói sản phẩm?', 'option': 'Cẩn thận'}]"
15305335,5548976,15973974,2,Không hài lòng,"Mình mua hàng tiki rất nhiều lần, mua sữa milo cũng nhiều rồi. Mà lần này thực sự thất vọng với đơn hàng này. Sữa milo hạn sử dụng 8 tháng, mà tiki giao cho mình thùng này với hsd đã bị trôi mất 4 tháng. Mình nhận hàng vào ngày 3.3.2022, mà tới 7.7.2022 đã hết hạn. Thùng sữa đợt trước mua trên tiki bị trôi 2 tháng thì còn chấp nhận được, đằng này tiki lại giao hàng cũ cho mình. Cứ thế này thì không biết có nên tiếp tục đặt sữa trên tiki ko nữa. Thực sự không hài lòng chút nào với đơn hàng này",approved,0,0,"[""https://salt.tikicdn.com/ts/review/2f/8a/10/ea9886fd1af692f551e6b5850d39c0f6.jpg"", ""https://salt.tikicdn.com/ts/review/27/45/d1/36db4914b37f865c3193f11a6dd808ce.jpg"", ""https://salt.tikicdn.com/ts/review/38/fd/05/2f1212671c753da3b5d5471c8bfec627.jpg"", ""https://salt.tikicdn.com/ts/review/d4/68/08/aa8ee07ba270ed370441fdd4fa081963.jpg""]","[{""id"": 3204715, ""full_path"": ""https://salt.tikicdn.com/ts/review/2f/8a/10/ea9886fd1af692f551e6b5850d39c0f6.jpg"", ""status"": ""approved""}, {""id"": 3204716, ""full_path"": ""https://salt.tikicdn.com/ts/review/27/45/d1/36db4914b37f865c3193f11a6dd808ce.jpg"", ""status"": ""approved""}, {""id"": 3204717, ""full_path"": ""https://salt.tikicdn.com/ts/review/38/fd/05/2f1212671c753da3b5d5471c8bfec627.jpg"", ""status"": ""approved""}, {""id"": 3204718, ""full_path"": ""https://salt.tikicdn.com/ts/review/d4/68/08/aa8ee07ba270ed370441fdd4fa081963.jpg"", ""status"": ""approved""}]","[""https://salt.tikicdn.com/ts/review/2f/8a/10/ea9886fd1af692f551e6b5850d39c0f6.jpg"", ""https://salt.tikicdn.com/ts/review/27/45/d1/36db4914b37f865c3193f11a6dd808ce.jpg"", ""https://salt.tikicdn.com/ts/review/38/fd/05/2f1212671c753da3b5d5471c8bfec627.jpg"", ""https://salt.tikicdn.com/ts/review/d4/68/08/aa8ee07ba270ed370441fdd4fa081963.jpg""]",https://salt.tikicdn.com/ts/review/2f/8a/10/ea9886fd1af692f551e6b5850d39c0f6.jpg | https://salt.tikicdn.com/ts/review/27/45/d1/36db4914b37f865c3193f11a6dd808ce.jpg | https://salt.tikicdn.com/ts/review/38/fd/05/2f1212671c753da3b5d5471c8bfec627.jpg | https://salt.tikicdn.com/ts/review/d4/68/08/aa8ee07ba270ed370441fdd4fa081963.jpg,4,True,https://salt.tikicdn.com/ts/review/2f/8a/10/ea9886fd1af692f551e6b5850d39c0f6.jpg,1.0,Tiki Trading,[]
18703461,494671,15973974,5,Cực kì hài lòng,"* Sản phẩm rất xinh đẹp tuyệt vời, tôi không thể trông đợi gì hơn. Cảm ơn nhà cung cấp, nhà sản xuất, cảm ơn người bán hàng, cảm ơn sàn thương mại điện tử, cảm ơn người vận chuyển để tôi có cơ hội dùng sản phẩm tốt như thế này. 

* Hàng đóng gói rất đẹp. Quả nhiên người bán đã gửi gắm rất nhiều tâm tư và tình cảm trong lúc gói hàng. Hộp không có dấu hiệu bị móp, chứng tỏ bộ phận vận chuyển đã nâng như nâng trứng, hứng như hứng hoa. Xin nghiêng mình cảm ơn vì tất cả. 

* Thời gian vận chuyển rất hợp lí. Tôi đã đặt hàng với tâm thế hào hứng chờ đợi để được trải nghiệm sản phẩm và tôi không hề bị chờ mỏi cổ. Có thể thấy bên vận chuyển không quản ngại thời tiết và đường xá xa xôi để đưa sản phẩm cho tôi trong thời gian ngắn nhất.",approved,0,0,"[""https://salt.tikicdn.com/ts/review/26/8a/83/48ee0e1f30d4b2bf73041782774d01e8.jpg""]","[{""id"": 4094669, ""full_path"": ""https://salt.tikicdn.com/ts/review/26/8a/83/48ee0e1f30d4b2bf73041782774d01e8.jpg"", ""status"": ""approved""}]","[""https://salt.tikicdn.com/ts/review/26/8a/83/48ee0e1f30d4b2bf73041782774d01e8.jpg""]",https://salt.tikicdn.com/ts/review/26/8a/83/48ee0e1f30d4b2bf73041782774d01e8.jpg,1,True,https://salt.tikicdn.com/ts/review/26/8a/83/48ee0e1f30d4b2bf73041782774d01e8.jpg,1.0,Tiki Trading,[]
16431543,26089941,15973974,5,Cực kì hài lòng,"hàng mua của tiki nên hoàn toàn yên tâm về chất lượng, giao hàng siêu nhanh, giá hợp lý,hạn xa, trong quá trình vận chuyển có hơi bị móp nhưng k ảnh hưởng đến hộp sữa bên trong. cảm ơn shop ạ",approved,1,0,"[""https://salt.tikicdn.com/ts/review/61/1c/ea/c025a17001bc0dbbdf8c28d4ef09bb59.jpg"", ""https://salt.tikicdn.com/ts/review/03/4a/4c/04d411253d300e9ad81289becd1842d4.jpg"", ""https://salt.tikicdn.com/ts/review/15/0f/08/caa6ee07467935a177c48ce46b01876b.jpg"", ""https://salt.tikicdn.com/ts/review/bc/cb/ce/e67a36c983f6bcbe94f25e922ffc70e8.jpg""]","[{""id"": 3505421, ""full_path"": ""https://salt.tikicdn.com/ts/review/61/1c/ea/c025a17001bc0dbbdf8c28d4ef09bb59.jpg"", ""status"": ""approved""}, {""id"": 3505422, ""full_path"": ""https://salt.tikicdn.com/ts/review/03/4a/4c/04d411253d300e9ad81289becd1842d4.jpg"", ""status"": ""approved""}, {""id"": 3505423, ""full_path"": ""https://salt.tikicdn.com/ts/review/15/0f/08/caa6ee07467935a177c48ce46b01876b.jpg"", ""status"": ""approved""}, {""id"": 3505424, ""full_path"": ""https://salt.tikicdn.com/ts/review/bc/cb/ce/e67a36c983f6bcbe94f25e922ffc70e8.jpg"", ""status"": ""approved""}]","[""https://salt.tikicdn.com/ts/review/61/1c/ea/c025a17001bc0dbbdf8c28d4ef09bb59.jpg"", ""https://salt.tikicdn.com/ts/review/03/4a/4c/04d411253d300e9ad81289becd1842d4.jpg"", ""https://salt.tikicdn.com/ts/review/15/0f/08/caa6ee07467935a177c48ce46b01876b.jpg"", ""https://salt.tikicdn.com/ts/review/bc/cb/ce/e67a36c983f6bcbe94f25e922ffc70e8.jpg""]",https://salt.tikicdn.com/ts/review/61/1c/ea/c025a17001bc0dbbdf8c28d4ef09bb59.jpg | https://salt.tikicdn.com/ts/review/03/4a/4c/04d411253d300e9ad81289becd1842d4.jpg | https://salt.tikicdn.com/ts/review/15/0f/08/caa6ee07467935a177c48ce46b01876b.jpg | https://salt.tikicdn.com/ts/review/bc/cb/ce/e67a36c983f6bcbe94f25e922ffc70e8.jpg,4,True,https://salt.tikicdn.com/ts/review/61/1c/ea/c025a17001bc0dbbdf8c28d4ef09bb59.jpg,1.0,Tiki Trading,[]
12473011,15352577,15973974,5,Cực kì hài lòng,"hàng gửi nhanh ,giao hàng thân thiện, con trai tôi nói là sữa uống ok .chúc shop buôn may bán đắt, bán hàng có tâm ,đúng chất lượng, bán hàng uy tín ,khách hàng sẽ tự tìm đến mua ,....chúc shop đông khách .Con trai tôi bóc hết vỏ bọc sản phẩm cửa hang của shop đóng gói rồi nên tôi không chụp được .",approved,2,1,"[""https://salt.tikicdn.com/ts/review/05/98/ff/9d0a9ee4120f0ab06673542dc41f9d63.jpg"", ""https://salt.tikicdn.com/ts/review/c8/c0/d0/52852d59538285cb459cb6331e6407e0.jpg"", ""https://salt.tikicdn.com/ts/review/ed/dd/01/325e78d46cf9a0d36cc553902a7dd6cf.jpg""]","[{""id"": 2561984, ""full_path"": ""https://salt.tikicdn.com/ts/review/05/98/ff/9d0a9ee4120f0ab06673542dc41f9d63.jpg"", ""status"": ""approved""}, {""id"": 2561985, ""full_path"": ""https://salt.tikicdn.com/ts/review/c8/c0/d0/52852d59538285cb459cb6331e6407e0.jpg"", ""status"": ""approved""}, {""id"": 2561986, ""full_path"": ""https://salt.tikicdn.com/ts/review/ed/dd/01/325e78d46cf9a0d36cc553902a7dd6cf.jpg"", ""status"": ""approved""}]","[""https://salt.tikicdn.com/ts/review/05/98/ff/9d0a9ee4120f0ab06673542dc41f9d63.jpg"", ""https://salt.tikicdn.com/ts/review/c8/c0/d0/52852d59538285cb459cb6331e6407e0.jpg"", ""https://salt.tikicdn.com/ts/review/ed/dd/01/325e78d46cf9a0d36cc553902a7dd6cf.jpg""]",https://salt.tikicdn.com/ts/review/05/98/ff/9d0a9ee4120f0ab06673542dc41f9d63.jpg | https://salt.tikicdn.com/ts/review/c8/c0/d0/52852d59538285cb459cb6331e6407e0.jpg | https://salt.tikicdn.com/ts/review/ed/dd/01/325e78d46cf9a0d36cc553902a7dd6cf.jpg,3,True,https://salt.tikicdn.com/ts/review/05/98/ff/9d0a9ee4120f0ab06673542dc41f9d63.jpg,1.0,Tiki Trading,[]
14366350,26416462,15973974,5,Cực kì hài lòng,"mua trên trading nên ko lo về chất lượng sp nha mng hsd ổn, ship về hàng ko bị móp lắm, sữa ngon hehee mng nên mua nha nhưng nên để ý hsd neh 10 đỉm 10 đỉm ❤️❤️❤️",approved,2,0,"[""https://salt.tikicdn.com/ts/review/f4/81/0a/5b7d24ece1b68f5e1160480817ed9f79.jpg"", ""https://salt.tikicdn.com/ts/review/99/97/d3/7505133ab3dcffcee33ffad655ebf6a3.jpg"", ""https://salt.tikicdn.com/ts/review/f4/81/0a/6dcca543dbf6a834179690c4db551b50.jpg"", ""https://salt.tikicdn.com/ts/review/d8/e9/fd/d08b570abb45ef1c0bd7db66fdcd190a.jpg"", ""https://salt.tikicdn.com/ts/review/08/34/16/d410a4be461a090fb5cc63846063504f.jpg""]","[{""id"": 3007240, ""full_path"": ""https://salt.tikicdn.com/ts/review/f4/81/0a/5b7d24ece1b68f5e1160480817ed9f79.jpg"", ""status"": ""approved""}, {""id"": 3007241, ""full_path"": ""https://salt.tikicdn.com/ts/review/99/97/d3/7505133ab3dcffcee33ffad655ebf6a3.jpg"", ""status"": ""approved""}, {""id"": 3007242, ""full_path"": ""https://salt.tikicdn.com/ts/review/f4/81/0a/6dcca543dbf6a834179690c4db551b50.jpg"", ""status"": ""approved""}, {""id"": 3007243, ""full_path"": ""https://salt.tikicdn.com/ts/review/d8/e9/fd/d08b570abb45ef1c0bd7db66fdcd190a.jpg"", ""status"": ""approved""}, {""id"": 3007244, ""full_path"": ""https://salt.tikicdn.com/ts/review/08/34/16/d410a4be461a090fb5cc63846063504f.jpg"", ""status"": ""approved""}]","[""https://salt.tikicdn.com/ts/review/f4/81/0a/5b7d24ece1b68f5e1160480817ed9f79.jpg"", ""https://salt.tikicdn.com/ts/review/99/97/d3/7505133ab3dcffcee33ffad655ebf6a3.jpg"", ""https://salt.tikicdn.com/ts/review/f4/81/0a/6dcca543dbf6a834179690c4db551b50.jpg"", ""https://salt.tikicdn.com/ts/review/d8/e9/fd/d08b570abb45ef1c0bd7db66fdcd190a.jpg"", ""https://salt.tikicdn.com/ts/review/08/34/16/d410a4be461a090fb5cc63846063504f.jpg""]",https://salt.tikicdn.com/ts/review/f4/81/0a/5b7d24ece1b68f5e1160480817ed9f79.jpg | https://salt.tikicdn.com/ts/review/99/97/d3/7505133ab3dcffcee33ffad655ebf6a3.jpg | https://salt.tikicdn.com/ts/review/f4/81/0a/6dcca543dbf6a834179690c4db551b50.jpg | https://salt.tikicdn.com/ts/review/d8/e9/fd/d08b570abb45ef1c0bd7db66fdcd190a.jpg | https://salt.tikicdn.com/ts/review/08/34/16/d410a4be461a090fb5cc63846063504f.jpg,5,True,https://salt.tikicdn.com/ts/review/f4/81/0a/5b7d24ece1b68f5e1160480817ed9f79.jpg,1.0,Tiki Trading,[]
16643751,25936457,15973974,5,Cực kì hài lòng,"[TB] Soạn MPV gửi 999 tham gia, MobiFone tặng ngay 1GB Data TỐC ĐỘ CAO MỖI NGÀY xài NET thả ga, không cần Wifi. MIỄN PHÍ 3G/4G nghe Nhạc MV theo yêu cầu tại http://nhac.mobion.vn . Cước dịch vụ mobiOn chỉ 6.000đ/ngày. Từ chối CSKH, soạn TC gửi 9241",approved,0,0,"[""https://salt.tikicdn.com/ts/review/91/5b/ac/93317a557bbe8b1aa1d68264cece47a7.jpg"", ""https://salt.tikicdn.com/ts/review/4c/03/6b/22f31c8c7ef916b8cbb3d3a0c4aec0dd.jpg""]","[{""id"": 3568838, ""full_path"": ""https://salt.tikicdn.com/ts/review/91/5b/ac/93317a557bbe8b1aa1d68264cece47a7.jpg"", ""status"": ""approved""}, {""id"": 3568839, ""full_path"": ""https://salt.tikicdn.com/ts/review/4c/03/6b/22f31c8c7ef916b8cbb3d3a0c4aec0dd.jpg"", ""status"": ""approved""}]","[""https://salt.tikicdn.com/ts/review/91/5b/ac/93317a557bbe8b1aa1d68264cece47a7.jpg"", ""https://salt.tikicdn.com/ts/review/4c/03/6b/22f31c8c7ef916b8cbb3d3a0c4aec0dd.jpg""]",https://salt.tikicdn.com/ts/review/91/5b/ac/93317a557bbe8b1aa1d68264cece47a7.jpg | https://salt.tikicdn.com/ts/review/4c/03/6b/22f31c8c7ef916b8cbb3d3a0c4aec0dd.jpg,2,True,https://salt.tikicdn.com/ts/review/91/5b/ac/93317a557bbe8b1aa1d68264cece47a7.jpg,1.0,Tiki Trading,[]
